{
  "runId": "fixture_run_1",
  "listingKey": "fixture-listing",
  "gumroadProductUrl": "https://example.gumroad.com/l/fixture",
  "launchedAt": "2026-04-01T12:00:00Z",
  "plannedTitle": "Fixture Product Title",
  "plannedPrice": 2500,
  "actualTitle": "Fixture Product Title",
  "actualPrice": 2500,
  "titleChanged": false,
  "priceChanged": false,
  "descriptionChanged": false,
  "assetChanged": false,
  "manualAdjustments": [],
  "launchIssues": [],
  "snapshotAt": "2026-04-02T12:00:00Z",
  "views": 100,
  "salesCount": 3,
  "grossRevenue": 7500,
  "refundCount": 0,
  "conversionRate": 0.06,
  "qualitativeNotes": null
}
